{
  "document_id": "tt_30_2019_tt_byt",
  "metadata": {
    "title": "Sửa đổi, bổ sung một số điều về sàng lọc, chẩn đoán trước sinh và sơ sinh",
    "document_type": "Thông tư",
    "document_number": "30/2019/TT-BYT",
    "issue_date": "2019-12-03",
    "effective_date": "2020-02-01",
    "issuing_body": "Bộ Y tế",
    "validity_status": "Không xác định",
    "expiry_date": null,
    "source_url": "https://vbpl.vn/FileData/TW/Lists/vbpq/Attachments/141539/VanBanGoc_430399.pdf"
  },
  "articles": [
    {
      "article_id": "tt_30_2019_tt_byt_art_1",
      "article_number": "1",
      "article_title": "Sửa đổi, bổ sung một số điều của Thông tư số 34/2017/TT-BYT ngày 18 tháng 8 năm 2017 của Bộ trưởng Bộ Y tế hướng dẫn tư vấn, sàng lọc, chẩn đoán, điều trị trước sinh và sơ sinh",
      "chapter": null,
      "section": null,
      "intro": null,
      "clauses": [
        {
          "clause_id": "tt_30_2019_tt_byt_art_1_clause_1",
          "parent_article_id": "tt_30_2019_tt_byt_art_1",
          "clause_number": "1",
          "clause_text": "1. Sửa đổi khoản 2 Điều 2 như sau: “2. Sàng lọc trước sinh (còn gọi là tầm soát trước sinh) là việc sử dụng các kỹ thuật trong thời gian mang thai để phát hiện nguy cơ dị tật bào thai”.",
          "chunks": null
        },
        {
          "clause_id": "tt_30_2019_tt_byt_art_1_clause_2",
          "parent_article_id": "tt_30_2019_tt_byt_art_1",
          "clause_number": "2",
          "clause_text": "2. Sửa đổi khoản 3 Điều 2 như sau: “3. Sàng lọc sơ sinh (còn gọi là tầm soát sơ sinh) là việc sử dụng các kỹ thuật để phát hiện trẻ sơ sinh có nguy cơ mắc các bất thường bẩm sinh, các bệnh lý liên quan đến rối loạn nội tiết - chuyển hóa - di truyền nhưng chưa có biểu hiện trên lâm sàng ở giai đoạn sơ sinh”.",
          "chunks": null
        },
        {
          "clause_id": "tt_30_2019_tt_byt_art_1_clause_3",
          "parent_article_id": "tt_30_2019_tt_byt_art_1",
          "clause_number": "3",
          "clause_text": "3. Bổ sung Điều 10 như sau: “Điều 10. Chế độ báo cáo, thống kê Các cơ sở thực hiện việc tư vấn, sàng lọc, chẩn đoán, điều trị trước sinh và sơ sinh có trách nhiệm báo cáo, thống kê về các hoạt động của cơ sở. Việc báo cáo, thống kê thực hiện theo quy định của Bộ trưởng Bộ Y tế.”",
          "chunks": null
        }
      ]
    },
    {
      "article_id": "tt_30_2019_tt_byt_art_2",
      "article_number": "2",
      "article_title": "Hiệu lực thi hành",
      "chapter": null,
      "section": null,
      "intro": null,
      "clauses": [
        {
          "clause_id": "tt_30_2019_tt_byt_art_2_clause_1",
          "parent_article_id": "tt_30_2019_tt_byt_art_2",
          "clause_number": "1",
          "clause_text": "1. Thông tư này có hiệu lực thi hành từ ngày 01 tháng 02 năm 2020.",
          "chunks": null
        },
        {
          "clause_id": "tt_30_2019_tt_byt_art_2_clause_2",
          "parent_article_id": "tt_30_2019_tt_byt_art_2",
          "clause_number": "2",
          "clause_text": "2. Bãi bỏ khoản 2, khoản 3 Điều 2 Thông tư số 34/2017/TT-BYT ngày 18 tháng 8 năm 2017 của Bộ trưởng Bộ Y tế hướng dẫn tư vấn, sàng lọc, chẩn đoán, điều trị trước sinh và sơ sinh kể từ ngày Thông tư này có hiệu lực.",
          "chunks": null
        }
      ]
    },
    {
      "article_id": "tt_30_2019_tt_byt_art_3",
      "article_number": "3",
      "article_title": "Trách nhiệm thi hành",
      "chapter": null,
      "section": null,
      "intro": null,
      "clauses": [
        {
          "clause_id": "tt_30_2019_tt_byt_art_3_clause_1",
          "parent_article_id": "tt_30_2019_tt_byt_art_3",
          "clause_number": "1",
          "clause_text": "1. Giao Tổng cục trưởng Tổng cục Dân số xây dựng và trình Bộ trưởng Bộ Y tế ban hành Quyết định Hướng dẫn chuyên môn kỹ thuật về sàng lọc, chẩn đoán, điều trị trước sinh và sơ sinh để thay thế Quyết định số 573/QĐ-BYT ngày 11 tháng 02 năm 2010 của Bộ trưởng Bộ Y tế về việc ban hành Quy trình sàng lọc, chẩn đoán trước sinh và sơ sinh.",
          "chunks": null
        },
        {
          "clause_id": "tt_30_2019_tt_byt_art_3_clause_2",
          "parent_article_id": "tt_30_2019_tt_byt_art_3",
          "clause_number": "2",
          "clause_text": "2. Tổng cục trưởng Tổng cục Dân số; Vụ trưởng Vụ Sức khỏe Bà mẹ - Trẻ em; Cục trưởng Cục Quản lý khám, chữa bệnh; Thủ trưởng các đơn vị thuộc và trực thuộc Bộ Y tế; Giám đốc Sở Y tế tỉnh, thành phố trực thuộc trung ương chịu trách nhiệm thi hành Thông tư này. Trong quá trình thực hiện, nếu có khó khăn, vướng mắc, đề nghị các cơ quan, tổ chức, cá nhân phản ánh kịp thời về Bộ Y tế (Tổng cục Dân số) để xem xét, giải quyết",
          "chunks": null
        }
      ]
    }
  ],
  "footnotes": []
}