{
  "document_id": "tt_07_2001_tt_btp",
  "metadata": {
    "title": "Thông tư của Bộ Tư pháp số 07/2001/TT-BTP ngày 10 tháng 12 năm 2001 hướng dẫn thi hành một số quy định của Nghị định số 77/2001/NĐ-CP ngày 22 tháng 10 năm 2001 của Chính phủ quy định chi tiết về đăng ký kết hôn theo Nghị quyết số 35/2000/QH10 của Quốc hội",
    "document_type": "Thông tư",
    "document_number": "07/2001/TT-BTP",
    "issue_date": "2001-12-10",
    "effective_date": "2001-12-25",
    "issuing_body": "Bộ Tư pháp",
    "validity_status": "Hết hiệu lực",
    "expiry_date": "2016-01-02",
    "source_url": "https://vbpl.vn/botuphap/Pages/vbpq-toanvan.aspx?ItemID=22902",
    "source_status": "Hết hiệu lực toàn bộ",
    "provision_status": "document_level_only"
  },
  "articles": [
    {
      "article_id": "tt_07_2001_tt_btp_art_1",
      "article_number": "1",
      "article_title": null,
      "chapter": "Chương I LẬP TỜ KHAI ĐĂNG KÝ KẾT HÔN",
      "section": null,
      "intro": null,
      "clauses": [
        {
          "clause_id": "tt_07_2001_tt_btp_art_1_clause_1",
          "parent_article_id": "tt_07_2001_tt_btp_art_1",
          "clause_number": "1",
          "clause_text": "Khi đăng ký kết hôn, hai bên lập Tờ khai đăng ký kết hôn theo mẫu hiện hành (mẫu TP/HT-1999-B.1), đồng thời ghi bổ sung vào dòng cuối cùng mặt thứ nhất của Tờ khai đăng ký kết hôn nội dung sau đây: \"Chúng tôi đã xác lập quan hệ vợ chồng từ ngày.... tháng... năm... đến nay\" (đối với trường hợp xác lập quan hệ vợ chồng trước ngày 03 tháng 01 năm 1987) hoặc \"Chúng tôi đã chung sống với nhau như vợ chồng từ ngày... tháng... năm... đến nay\" (đối với trường hợp nam và nữ chung sống với nhau như vợ chồng từ sau ngày 03 tháng 01 năm 1987 đến trước ngày 01 tháng 01 năm 2001) Nếu hai bên không xác định được ngày hoặc cả ngày và tháng xác lập quan hệ vợ chồng hoặc chung sống với nhau như vợ chồng, thì ghi theo cách tính thời gian quy định tại Khoản 2 Điều 5 của Nghị định số 77/2001/NĐ-CP.",
          "chunks": null
        }
      ]
    },
    {
      "article_id": "tt_07_2001_tt_btp_art_2",
      "article_number": "2",
      "article_title": null,
      "chapter": "Chương II GHI NGÀY HÔN NHÂN CÓ HIỆU LỰC",
      "section": null,
      "intro": null,
      "clauses": [
        {
          "clause_id": "tt_07_2001_tt_btp_art_2_clause_1",
          "parent_article_id": "tt_07_2001_tt_btp_art_2",
          "clause_number": "1",
          "clause_text": "Khi đăng ký kết hôn, Ủy ban nhân dân cấp xã sử dụng mẫu Giấy chứng nhận kết hôn hiện hành (Mẫu TP/HT-1999-B.2) và Sổ đăng ký kết hôn hiện hành (mẫu TP/HT-1999-B), nhưng phải bổ sung vào dưới tiêu đề của Giấy chứng nhận kết hôn và vào cột Ghi chú của Sổ đăng ký kết hôn dòng chữ: ĐĂNG KÝ THEO NGHỊ ĐỊNH SỐ 77/2001/NĐ-CP HÔN NHÂN CÓ HIỆU LỰC TỪ NGÀY... THÁNG.... NĂM.... và đóng dấu của Ủy ban nhân dân vào chỗ ghi bổ sung này.",
          "chunks": null
        }
      ]
    },
    {
      "article_id": "tt_07_2001_tt_btp_art_3",
      "article_number": "3",
      "article_title": null,
      "chapter": "Chương III KHAI SINH CHO CON CHUNG CỦA VỢ CHỒNG",
      "section": null,
      "intro": "Việc khai sinh cho con chung của vợ chồng đã đăng ký kết hôn theo Nghị định số 77/2001/NĐ-CP được giải quyết như sau:",
      "clauses": [
        {
          "clause_id": "tt_07_2001_tt_btp_art_3_clause_1",
          "parent_article_id": "tt_07_2001_tt_btp_art_3",
          "clause_number": "1",
          "clause_text": "1. Nếu người con đã đăng ký khai sinh mà trong Giấy khai sinh và Sổ đăng ký khai sinh vẫn để trống phần ghi về người cha, thì Ủy ban nhân dân cấp xã, nơi đã đăng ký khai sinh, căn cứ vào Giấy chứng nhận kết hôn của cha mẹ, ghi bổ sung về người cha vào Sổ đăng ký khai sinh và Giấy khai sinh của người con theo quy định tại Điều 9 của Nghị định số 77/2001/NĐ-CP.",
          "chunks": null
        },
        {
          "clause_id": "tt_07_2001_tt_btp_art_3_clause_2",
          "parent_article_id": "tt_07_2001_tt_btp_art_3",
          "clause_number": "2",
          "clause_text": "2. Nếu người con đã đăng ký khai sinh, những trong Sổ đăng ký khai sinh và Giấy khai sinh của người con đã ghi người khác trong phần ghi về người cha, thì đương sự phải làm thủ tục xin thay đổi, cải chính hộ tịch theo quy định của pháp luật về đăng ký hộ tịch.",
          "chunks": null
        },
        {
          "clause_id": "tt_07_2001_tt_btp_art_3_clause_3",
          "parent_article_id": "tt_07_2001_tt_btp_art_3",
          "clause_number": "3",
          "clause_text": "3. Nếu người con chưa đăng ký khai sinh, thì Ủy ban nhân dân cấp xã, nơi đăng ký kết hôn cho cha mẹ, căn cứ vào Giấy chứng nhận kết hôn của cha mẹ, thực hiện việc đăng ký khai sinh cho người con theo thủ tục đăng ký khai sinh cho con trong giá thú.",
          "chunks": null
        }
      ]
    },
    {
      "article_id": "tt_07_2001_tt_btp_art_4",
      "article_number": "4",
      "article_title": null,
      "chapter": "Chương IV ÁP DỤNG ĐỐI VỚI CÁC TRƯỜNG HỢP ĐĂNG KÝ KẾT HÔN TRƯỚC NGÀY NGHỊ ĐỊNH SỐ 77/2001/NĐ-CP CÓ HIỆU LỰC",
      "section": null,
      "intro": null,
      "clauses": [
        {
          "clause_id": "tt_07_2001_tt_btp_art_4_clause_1",
          "parent_article_id": "tt_07_2001_tt_btp_art_4",
          "clause_number": "1",
          "clause_text": "Đối với các trường hợp đã đăng ký kết hôn theo Nghị quyết số 35/2000/QH10 của Quốc hội trước ngày Nghị định số 77/2001/NĐ-CP có hiệu lực thi hành, thì việc đăng ký kết hôn đó vẫn có giá trị pháp lý. Nếu vợ chồng có yêu cầu được công nhận ngày hôn nhân có hiệu lực theo quy định tại Điều 3 của Nghị định số 77/2001/NĐ-CP, thì Ủy ban nhân dân cấp xã, nơi đã đăng ký kết hôn cho họ, thực hiện việc ghi bổ sung theo quy định tại Điểm II của Thông tư này.",
          "chunks": null
        }
      ]
    },
    {
      "article_id": "tt_07_2001_tt_btp_art_5",
      "article_number": "5",
      "article_title": null,
      "chapter": "Chương V TỔ CHỨC THỰC HIỆN",
      "section": null,
      "intro": null,
      "clauses": [
        {
          "clause_id": "tt_07_2001_tt_btp_art_5_clause_1",
          "parent_article_id": "tt_07_2001_tt_btp_art_5",
          "clause_number": "1",
          "clause_text": "Thông tư này có hiệu lực thi hành sau 15 ngày kể từ ngày ký.",
          "chunks": null
        }
      ]
    },
    {
      "article_id": "tt_07_2001_tt_btp_art_6",
      "article_number": "6",
      "article_title": null,
      "chapter": "Chương V TỔ CHỨC THỰC HIỆN",
      "section": null,
      "intro": null,
      "clauses": [
        {
          "clause_id": "tt_07_2001_tt_btp_art_6_clause_1",
          "parent_article_id": "tt_07_2001_tt_btp_art_6",
          "clause_number": "1",
          "clause_text": "Sở Tư pháp có trách nhiệm giúp Ủy ban nhân dân các tỉnh, thành phố trực thuộc Trung ương hướng dẫn, chỉ đạo, kiểm tra việc thi hành Nghị định số 77/2001/NĐ-CP và Thông tư này trong phạm vi địa phương mình, lưu ý những trường hợp nam và nữ chung sống với nhau như vợ chồng từ ngày 03 tháng 01 năm 1987 đến trước ngày 01 tháng 01 năm 2001 chỉ được đăng ký kết hôn theo Nghị định số 77/2001/NĐ-CP đến hết ngày 01 tháng 01 năm 2003.",
          "chunks": null
        }
      ]
    },
    {
      "article_id": "tt_07_2001_tt_btp_art_7",
      "article_number": "7",
      "article_title": null,
      "chapter": "Chương V TỔ CHỨC THỰC HIỆN",
      "section": null,
      "intro": null,
      "clauses": [
        {
          "clause_id": "tt_07_2001_tt_btp_art_7_clause_1",
          "parent_article_id": "tt_07_2001_tt_btp_art_7",
          "clause_number": "1",
          "clause_text": "Trong quá trình thực hiện, nếu có vướng mắc hoặc phát sinh những vấn đề mới, Ủy ban nhân dân cấp tỉnh, Sở Tư pháp và các cơ quan liên quan có công văn gửi Bộ Tư pháp để có văn bản hướng dẫn.",
          "chunks": null
        }
      ]
    }
  ],
  "footnotes": []
}